{
  "$schema": "https://json-schema.org/draft/2020-12/schema",
  "title": "Future Edition Source",
  "type": "object",
  "additionalProperties": false,
  "required": ["id", "kind", "tier", "title", "canonical_url", "status", "observed_at", "valid_from", "valid_to", "review_state"],
  "properties": {
    "id": {"type": "string", "pattern": "^SRC-[0-9]{6}$"},
    "kind": {"enum": ["paper", "preprint", "trial_registry", "regulator", "official_data", "technical_report", "institution_release", "media", "social", "correction_notice", "retraction_notice", "other"]},
    "tier": {"enum": ["A", "B", "C", "D"]},
    "title": {"type": "string", "minLength": 1},
    "canonical_url": {"type": "string", "format": "uri"},
    "external_ids": {"type": "object", "additionalProperties": {"type": ["string", "null"]}},
    "author_ids": {"type": "array", "uniqueItems": true, "items": {"type": "string", "pattern": "^PERSON-[0-9]{6}$"}},
    "organization_ids": {"type": "array", "uniqueItems": true, "items": {"type": "string", "pattern": "^ORG-[0-9]{6}$"}},
    "published_at": {"type": ["string", "null"], "format": "date"},
    "status": {"enum": ["active", "corrected", "expression_of_concern", "retracted", "unknown"]},
    "version": {"type": "integer", "minimum": 1},
    "supersedes_source_id": {"type": ["string", "null"], "pattern": "^SRC-[0-9]{6}$"},
    "review_state": {"enum": ["machine_proposed", "human_approved", "human_rejected", "not_required"]},
    "observed_at": {"type": "string", "format": "date-time"},
    "valid_from": {"type": ["string", "null"], "format": "date-time"},
    "valid_to": {"type": ["string", "null"], "format": "date-time"}
  }
}
