[
  {
    "id": "SRC-050001",
    "kind": "regulator",
    "tier": "A",
    "title": "Purple Book product details: Herceptin",
    "canonical_url": "https://purplebooksearch.fda.gov/index.cfm?blaNo=103792&event=productdetails",
    "author_ids": [],
    "organization_ids": [],
    "published_at": "1998-09-25",
    "status": "active",
    "version": 1,
    "supersedes_source_id": null,
    "review_state": "not_required",
    "observed_at": "2026-09-20T14:45:00Z",
    "valid_from": "1998-09-25T00:00:00Z",
    "valid_to": null
  },
  {
    "id": "SRC-050002",
    "kind": "regulator",
    "tier": "A",
    "title": "FDA Orphan Drug Designations and Approvals: Gleevec",
    "canonical_url": "https://www.accessdata.fda.gov/scripts/opdlisting/oopd/detailedIndex.cfm?cfgridkey=140100",
    "author_ids": [],
    "organization_ids": [],
    "published_at": "2001-05-10",
    "status": "active",
    "version": 1,
    "supersedes_source_id": null,
    "review_state": "not_required",
    "observed_at": "2026-09-20T14:45:00Z",
    "valid_from": "2001-05-10T00:00:00Z",
    "valid_to": null
  },
  {
    "id": "SRC-050003",
    "kind": "regulator",
    "tier": "A",
    "title": "Purple Book product details: Provenge",
    "canonical_url": "https://purplebooksearch.fda.gov/index.cfm?blaNo=125197&event=productdetails",
    "author_ids": [],
    "organization_ids": [],
    "published_at": "2010-04-29",
    "status": "active",
    "version": 1,
    "supersedes_source_id": null,
    "review_state": "not_required",
    "observed_at": "2026-09-20T14:45:00Z",
    "valid_from": "2010-04-29T00:00:00Z",
    "valid_to": null
  },
  {
    "id": "SRC-050004",
    "kind": "regulator",
    "tier": "A",
    "title": "KYMRIAH",
    "canonical_url": "https://www.fda.gov/vaccines-blood-biologics/cellular-gene-therapy-products/kymriah",
    "author_ids": [],
    "organization_ids": [],
    "published_at": "2017-08-30",
    "status": "active",
    "version": 1,
    "supersedes_source_id": null,
    "review_state": "not_required",
    "observed_at": "2026-09-20T14:45:00Z",
    "valid_from": "2017-08-30T00:00:00Z",
    "valid_to": null
  },
  {
    "id": "SRC-050005",
    "kind": "regulator",
    "tier": "A",
    "title": "FDA approves pembrolizumab for first-line treatment of MSI-H/dMMR colorectal cancer",
    "canonical_url": "https://www.fda.gov/drugs/drug-approvals-and-databases/fda-approves-pembrolizumab-first-line-treatment-msi-hdmmr-colorectal-cancer",
    "author_ids": [],
    "organization_ids": [],
    "published_at": "2020-06-29",
    "status": "active",
    "version": 1,
    "supersedes_source_id": null,
    "review_state": "not_required",
    "observed_at": "2026-09-20T14:45:00Z",
    "valid_from": "2020-06-29T00:00:00Z",
    "valid_to": null
  },
  {
    "id": "SRC-050006",
    "kind": "paper",
    "tier": "A",
    "title": "Rapamycin fed late in life extends lifespan in genetically heterogeneous mice",
    "canonical_url": "https://www.nature.com/articles/nature08221",
    "author_ids": [],
    "organization_ids": [],
    "published_at": "2009-07-08",
    "status": "active",
    "version": 1,
    "supersedes_source_id": null,
    "review_state": "not_required",
    "observed_at": "2026-09-20T14:45:00Z",
    "valid_from": "2009-07-08T00:00:00Z",
    "valid_to": null
  },
  {
    "id": "SRC-050007",
    "kind": "paper",
    "tier": "A",
    "title": "Clearance of p16Ink4a-positive senescent cells delays ageing-associated disorders",
    "canonical_url": "https://www.nature.com/articles/nature10600",
    "author_ids": [],
    "organization_ids": [],
    "published_at": "2011-11-02",
    "status": "active",
    "version": 1,
    "supersedes_source_id": null,
    "review_state": "not_required",
    "observed_at": "2026-09-20T14:45:00Z",
    "valid_from": "2011-11-02T00:00:00Z",
    "valid_to": null
  },
  {
    "id": "SRC-050008",
    "kind": "paper",
    "tier": "A",
    "title": "Naturally occurring p16Ink4a-positive cells shorten healthy lifespan",
    "canonical_url": "https://www.nature.com/articles/nature16932",
    "author_ids": [],
    "organization_ids": [],
    "published_at": "2016-02-03",
    "status": "active",
    "version": 1,
    "supersedes_source_id": null,
    "review_state": "not_required",
    "observed_at": "2026-09-20T14:45:00Z",
    "valid_from": "2016-02-03T00:00:00Z",
    "valid_to": null
  },
  {
    "id": "SRC-050009",
    "kind": "paper",
    "tier": "A",
    "title": "Metabolic Slowing and Reduced Oxidative Damage with Sustained Caloric Restriction Support the Rate of Living and Oxidative Damage Theories of Aging",
    "canonical_url": "https://pubmed.ncbi.nlm.nih.gov/29576535/",
    "author_ids": [],
    "organization_ids": [],
    "published_at": "2018-03-22",
    "status": "active",
    "version": 1,
    "supersedes_source_id": null,
    "review_state": "not_required",
    "observed_at": "2026-09-20T14:45:00Z",
    "valid_from": "2018-03-22T00:00:00Z",
    "valid_to": null
  },
  {
    "id": "SRC-050010",
    "kind": "paper",
    "tier": "A",
    "title": "Effect of long-term caloric restriction on DNA methylation measures of biological aging in healthy adults from the CALERIE trial",
    "canonical_url": "https://www.nature.com/articles/s43587-022-00357-y",
    "author_ids": [],
    "organization_ids": [],
    "published_at": "2023-02-09",
    "status": "active",
    "version": 1,
    "supersedes_source_id": null,
    "review_state": "not_required",
    "observed_at": "2026-09-20T14:45:00Z",
    "valid_from": "2023-02-09T00:00:00Z",
    "valid_to": null
  },
  {
    "id": "SRC-050011",
    "kind": "paper",
    "tier": "A",
    "title": "Epidural stimulation of the lumbosacral spinal cord enables voluntary movement, standing, and assisted stepping after motor complete paraplegia",
    "canonical_url": "https://www.sciencedirect.com/science/article/abs/pii/S0140673611605473",
    "author_ids": [],
    "organization_ids": [],
    "published_at": "2011-06-04",
    "status": "active",
    "version": 1,
    "supersedes_source_id": null,
    "review_state": "not_required",
    "observed_at": "2026-09-20T14:45:00Z",
    "valid_from": "2011-06-04T00:00:00Z",
    "valid_to": null
  },
  {
    "id": "SRC-050012",
    "kind": "paper",
    "tier": "A",
    "title": "Targeted neurotechnology restores walking in humans with spinal cord injury",
    "canonical_url": "https://www.nature.com/articles/s41586-018-0649-2",
    "author_ids": [],
    "organization_ids": [],
    "published_at": "2018-10-31",
    "status": "active",
    "version": 1,
    "supersedes_source_id": null,
    "review_state": "not_required",
    "observed_at": "2026-09-20T14:45:00Z",
    "valid_from": "2018-10-31T00:00:00Z",
    "valid_to": null
  },
  {
    "id": "SRC-050013",
    "kind": "paper",
    "tier": "A",
    "title": "Tetraplegic patient controls a four-limb exoskeleton over 24 months using a brain-machine interface",
    "canonical_url": "https://pubmed.ncbi.nlm.nih.gov/31587955/",
    "author_ids": [],
    "organization_ids": [],
    "published_at": "2019-10-03",
    "status": "active",
    "version": 1,
    "supersedes_source_id": null,
    "review_state": "not_required",
    "observed_at": "2026-09-20T14:45:00Z",
    "valid_from": "2019-10-03T00:00:00Z",
    "valid_to": null
  },
  {
    "id": "SRC-050014",
    "kind": "paper",
    "tier": "A",
    "title": "Activity-dependent spinal cord neuromodulation rapidly restores trunk and leg motor functions after complete paralysis",
    "canonical_url": "https://www.nature.com/articles/s41591-021-01663-5",
    "author_ids": [],
    "organization_ids": [],
    "published_at": "2022-02-07",
    "status": "active",
    "version": 1,
    "supersedes_source_id": null,
    "review_state": "not_required",
    "observed_at": "2026-09-20T14:45:00Z",
    "valid_from": "2022-02-07T00:00:00Z",
    "valid_to": null
  },
  {
    "id": "SRC-050015",
    "kind": "paper",
    "tier": "A",
    "title": "Walking naturally after spinal cord injury using a brain–spine interface",
    "canonical_url": "https://www.nature.com/articles/s41586-023-06094-5",
    "author_ids": [],
    "organization_ids": [],
    "published_at": "2023-05-24",
    "status": "active",
    "version": 1,
    "supersedes_source_id": null,
    "review_state": "not_required",
    "observed_at": "2026-09-20T14:45:00Z",
    "valid_from": "2023-05-24T00:00:00Z",
    "valid_to": null
  },
  {
    "id": "SRC-050016",
    "kind": "regulator",
    "tier": "A",
    "title": "HDE database: Argus II Retinal Prosthesis System",
    "canonical_url": "https://www.accessdata.fda.gov/scripts/cdrh/cfdocs/cfhde/hde.cfm?id=375562",
    "author_ids": [],
    "organization_ids": [],
    "published_at": "2013-02-13",
    "status": "active",
    "version": 1,
    "supersedes_source_id": null,
    "review_state": "not_required",
    "observed_at": "2026-09-20T14:45:00Z",
    "valid_from": "2013-02-13T00:00:00Z",
    "valid_to": null
  },
  {
    "id": "SRC-050017",
    "kind": "paper",
    "tier": "A",
    "title": "Human embryonic stem cell-derived retinal pigment epithelium in patients with age-related macular degeneration and Stargardt's macular dystrophy",
    "canonical_url": "https://pubmed.ncbi.nlm.nih.gov/25458728/",
    "author_ids": [],
    "organization_ids": [],
    "published_at": "2014-10-15",
    "status": "active",
    "version": 1,
    "supersedes_source_id": null,
    "review_state": "not_required",
    "observed_at": "2026-09-20T14:45:00Z",
    "valid_from": "2014-10-15T00:00:00Z",
    "valid_to": null
  },
  {
    "id": "SRC-050018",
    "kind": "paper",
    "tier": "A",
    "title": "Efficacy of voretigene neparvovec gene therapy for RPE65-mediated inherited retinal dystrophy",
    "canonical_url": "https://pmc.ncbi.nlm.nih.gov/articles/PMC5726391/",
    "author_ids": [],
    "organization_ids": [],
    "published_at": "2017-07-14",
    "status": "active",
    "version": 1,
    "supersedes_source_id": null,
    "review_state": "not_required",